{
  "$schema": "https://json-schema.org/draft/2020-12/schema",
  "$id": "https://omniproject.dev/vendors/broker.schema.json",
  "title": "OmniProject broker vendor",
  "description": "An automation/translation platform that drives a backend binding. One file per vendor under vendors/brokers/<id>.json.",
  "type": "object",
  "additionalProperties": false,
  "required": ["id", "label", "docsUrl", "kind", "hosted", "capabilities", "transports", "build"],
  "properties": {
    "id": { "type": "string", "pattern": "^[a-z0-9-]+$" },
    "label": { "type": "string" },
    "docsUrl": { "type": "string" },
    "kind": { "enum": ["low-code", "code-first", "serverless", "self-hosted-service"] },
    "hosted": { "type": "boolean" },
    "capabilities": {
      "type": "object",
      "additionalProperties": false,
      "required": ["synchronous", "selfHostable", "managedAuth", "eventsInbound", "eventsOutbound"],
      "properties": {
        "synchronous": { "type": "boolean", "enum": [true], "description": "Brokers ARE the synchronous data-hop plane — every broker can answer the binding's request in the SAME HTTP call. Async-only platforms (Airflow/Zapier) belong in the outputs/notifications planes, not here." },
        "selfHostable": { "type": "boolean" },
        "managedAuth": { "type": "boolean" },
        "eventsInbound": { "type": "boolean" },
        "eventsOutbound": { "type": "boolean" }
      }
    },
    "transports": { "type": "array", "items": { "enum": ["http", "native-node"] } },
    "build": { "enum": ["workflow-generator", "scenario-template", "component-template", "flow-template", "function-template", "implement-blueprint"] },
    "notes": { "type": "string" },
    "keyFormat": {
      "type": "object",
      "additionalProperties": false,
      "description": "The shape of the key required to reach this broker (used to hard-reject keyless access and to scaffold credentials).",
      "required": ["scheme"],
      "properties": {
        "scheme": { "enum": ["psk", "bearer", "apiKey", "basic", "oauth2", "per-user", "none"] },
        "env": { "type": "array", "items": { "type": "string" }, "description": "Operator-side env var(s) the key lives in." },
        "header": { "type": "string", "description": "HTTP header the key is presented in, if any." },
        "pattern": { "type": "string", "description": "Optional regex the key value must match (its format)." }
      }
    },
    "alsoProvides": {
      "type": "array",
      "items": {
        "type": "object",
        "additionalProperties": false,
        "required": ["plane"],
        "properties": {
          "plane": { "type": "string" },
          "note": { "type": "string" }
        }
      }
    }
  }
}
