{
  "build": "flow-template",
  "capabilities": {
    "eventsInbound": true,
    "eventsOutbound": true,
    "managedAuth": true,
    "selfHostable": false,
    "synchronous": true
  },
  "docsUrl": "https://learn.microsoft.com/en-us/power-automate/",
  "hosted": true,
  "id": "power-automate",
  "kind": "low-code",
  "label": "Microsoft Power Automate",
  "notes": "An HTTP-request-triggered cloud flow with a Response action serves the contract (premium connector). Native Microsoft 365 / Dataverse reach.",
  "transports": [
    "http"
  ]
}
